<?xml version="1.0"?>
<include xmlns:xsi="http://www.w3.org/2001/XMLSchema-instance" xsi:noNamespaceSchemaLocation="urn:magento:module:Vnecoms_PageBulder:etc/vcms_section_include.xsd">
    <!-- Header 1 -->
    <section name="pdf_other_1col">
        <type>pdf_other</type>
        <template>Vnecoms_PdfPro/section/pdf-other-1col</template>
        <component>Vnecoms_PageBuilder/js/section/default</component>
        <block_template>Vnecoms_PdfPro::section/pdf-other-1col.phtml</block_template>
        <preview_height>80px</preview_height>
        <fields>
           	<element name="text">
                <label>Text</label>
                <type>editor</type>
                <is_active>1</is_active>
                <data>
                    <code><![CDATA[<strong>Lorem Ipsum</strong> is simply dummy text of the printing and typesetting industry. Lorem Ipsum has been the industry's standard dummy text ever since the 1500s, when an unknown printer took a galley of type and scrambled it to make a type specimen book. It has survived not only five centuries, but also the leap into electronic typesetting, remaining essentially unchanged.]]></code>
                    <frontend_class>pdf-other-text</frontend_class>
                </data>
            </element>
        </fields>
    </section>
</include>