<?xml version="1.0"?>
<include xmlns:xsi="http://www.w3.org/2001/XMLSchema-instance" xsi:noNamespaceSchemaLocation="urn:magento:module:Vnecoms_PageBulder:etc/vcms_section_include.xsd">
    <!-- Items 1 block -->
    <section name="pdf_shipment_items1">
        <type>pdf_shipment_items</type>
        <template>Vnecoms_PdfPro/section/pdf-items1</template>
        <component>Vnecoms_PageBuilder/js/section/default</component>
        <block_template>Vnecoms_PdfPro::section/pdf-items1.phtml</block_template>
        <preview_height>110px</preview_height>
        <fields>
            <element name="items_list">
                <label>Items List</label>
                <type>list</type>
                <is_active>1</is_active>
                <data>
                    <template>Vnecoms_PdfPro/section/pdf-items1/list</template>
                    <block_template>Vnecoms_PdfPro::section/pdf-shipment-items1/list.phtml</block_template>
                    <edit_template>Vnecoms_PageBuilder/field/edit/list</edit_template>
                    <component>Vnecoms_PageBuilder/js/field/list</component>
                    <templateItem>items_col2</templateItem>
                    <canAddNewItem>1</canAddNewItem>
                </data>
                <fields>
                	<element name="items_col1">
                        <label>Items Column</label>
                        <type>group</type>
                        <is_active>1</is_active>
                        <data>
                            <template>Vnecoms_PdfPro/section/pdf-items1/group</template>
                            <block_template>Vnecoms_PdfPro::section/pdf-items1/group.phtml</block_template>
                            <label_element>header_label</label_element>
                            <frontend_class>pdf-items-col</frontend_class>
                            <component>Vnecoms_PdfPro/js/field/group-item</component>
                            <!-- The label of this element will be getting from this child field -->
                        </data>
                        <fields>
                            <element name="header_label">
                                <label>Header Label</label>
                                <type>editor</type>
                                <is_active>1</is_active>
                                <data>
                                    <code>QTY</code>
                                </data>
                            </element>
                            <element name="value">
                                <label>Value</label>
                                <type>editor</type>
                                <is_active>1</is_active>
                                <data>
                                    <code><![CDATA[{{var item.qty}}]]></code>
                                </data>
                            </element>
                        </fields>
                    </element>
                    <element name="items_col2">
                        <label>Items Column</label>
                        <type>group</type>
                        <is_active>1</is_active>
                        <data>
                            <template>Vnecoms_PdfPro/section/pdf-items1/group</template>
                            <block_template>Vnecoms_PdfPro::section/pdf-items1/group.phtml</block_template>
                            <label_element>header_label</label_element>
                            <frontend_class>pdf-items-col</frontend_class>
                            <component>Vnecoms_PdfPro/js/field/group-item</component>
                            <!-- The label of this element will be getting from this child field -->
                        </data>
                        <fields>
                            <element name="header_label">
                                <label>Header Label</label>
                                <type>editor</type>
                                <is_active>1</is_active>
                                <data>
                                    <code>Product</code>
                                </data>
                            </element>
                            <element name="value">
                                <label>Value</label>
                                <type>editor</type>
                                <is_active>1</is_active>
                                <data>
                                    <isCodeEditor>1</isCodeEditor>
                                    <code><![CDATA[{{var item.name}}
{{foreach1 item.options as option}}
	<label>{{var option.label}}</label> :{{var option.value}}<br />
{{/foreach1}}]]></code>
                                </data>
                            </element>
                        </fields>
                    </element>
                    <element name="items_col3">
                        <label>Items Column</label>
                        <type>group</type>
                        <is_active>1</is_active>
                        <data>
                            <template>Vnecoms_PdfPro/section/pdf-items1/group</template>
                            <block_template>Vnecoms_PdfPro::section/pdf-items1/group.phtml</block_template>
                            <label_element>header_label</label_element>
                            <frontend_class>pdf-items-col</frontend_class>
                            <component>Vnecoms_PdfPro/js/field/group-item</component>
                            <!-- The label of this element will be getting from this child field -->
                        </data>
                        <fields>
                            <element name="header_label">
                                <label>Header Label</label>
                                <type>editor</type>
                                <is_active>1</is_active>
                                <data>
                                    <code>Sku</code>
                                </data>
                            </element>
                            <element name="value">
                                <label>Value</label>
                                <type>editor</type>
                                <is_active>1</is_active>
                                <data>
                                    <code><![CDATA[{{var item.sku}}]]></code>
                                </data>
                            </element>
                        </fields>
                    </element>
                </fields>
            </element>
        </fields>
    </section>
</include>