<?xml version="1.0"?>
<include xmlns:xsi="http://www.w3.org/2001/XMLSchema-instance" xsi:noNamespaceSchemaLocation="urn:magento:module:Vnecoms_PageBulder:etc/vcms_section_include.xsd">
    <!-- Items 1 block -->
    <section name="pdf_creditmemo_totals1">
        <type>pdf_creditmemo_totals</type>
        <template>Vnecoms_PdfPro/section/pdf-totals1</template>
        <component>Vnecoms_PageBuilder/js/section/default</component>
        <block_template>Vnecoms_PdfPro::section/pdf-totals1.phtml</block_template>
        <preview_height>110px</preview_height>
        <fields>
            <element name="totals_block">
                 <label>Totals Block</label>
                 <type>editor</type>
                 <is_active>1</is_active>
                 <data>
					<template>Vnecoms_PdfPro/section/pdf-totals1/totals-block</template>
					<edit_template>Vnecoms_PdfPro/section/pdf-totals1/edit/totals-block</edit_template>
					<block_template>Vnecoms_PdfPro::section/pdf-creditmemo-totals1/totals-block.phtml</block_template>
                    <code>---</code>
                 </data>
             </element>
        </fields>
    </section>
</include>